raw,replaced
"Trump campaign blasts Jeff Sessions as 'delusional,' demands Senate campaign stop promoting ties to president .","Trump  Trump campaign blasts Sessions as 'delusional,' demands Senate campaign stop promoting ties to president ."
2020-04-02 19:24:05 +00:00 .,2020-04-02 19:24:05 +00:00 .
President Trump ’s re - election campaign on Thursday blasted former Jeff Sessions as “ delusional ” and demanded that the former attorney general “ immediately stop ” promoting ties to the president in his primary campaign for the U.S. Senate in Alabama .,Trump ’s re - election campaign on Thursday blasted Sessions as “ delusional ” and demanded that the former attorney general “ immediately stop ” promoting ties to Trump in the former attorney general primary campaign for the U.S. Senate in Alabama .
"Trump campaign chief operation officer Michael Glassner , in a scathing letter to Sessions , slammed his campaign ’s efforts to show his “ support ” for the president -- despite Sessions ' and Trump 's rocky history .","Trump  Trump campaign  Glassner , in The letter  Sessions , slammed Trump campaign  Glassner campaign ’s efforts to show Glassner “ support ” for Trump -- despite Sessions and Trump rocky history ."
ALABAMA POSTPONES PRIMARY RUNOFF PITTING SESSIONS AGAINST TRUMP - ENDORSED TUBERVILLE,ALABAMA POSTPONES PRIMARY RUNOFF PITTING SESSIONS AGAINST TRUMP - ENDORSED TUBERVILLE
"“ The Trump Campaign has learned that your U.S. Senate campaign is circulating mailers like the one I have enclosed , in which you misleadingly promote your connections to and ‘ support ’ of President Trump , ” Glassner wrote in the letter , which was first reported by The New York Times and later obtained by Fox News .","“ your campaign has learned that Trump campaign  your  Senate campaign is circulating mailers like the one I have enclosed , in which your misleadingly promote your connections to and ‘ support ’ of Trump , ” Glassner wrote in The letter  Fox News ."
"Glassner attached the mailer , which was a form for Sessions ’ donors and mentioned Trump by name “ 22 times . ”","Glassner attached the mailer , which was a form for Sessions donors and mentioned Trump by name “ 22 times . ”"
"“ The letter even makes the delusional assertion that you are President Trump ’s “ # 1 Supporter , ” Glassner wrote .","“ The letter even makes the delusional assertion that your are Trump ’s “ # 1 Supporter , ” Glassner wrote ."
“ We only assume your campaign is doing this to confuse President Trump ’s loyal supporters in Alabama into believing the President supports your candidacy in the upcoming primary runoff election . ”,“ We only assume Trump campaign  your campaign is doing this to confuse Trump ’s loyal supporters in Alabama into believing Trump supports your candidacy in the U.S. Senate election in Alabama . ”
He added : “ Nothing could be further from the truth . ”,Glassner added : “ Nothing could be further from the truth . ”
"“ We want to be absolutely clear about it , ” Glassner wrote .","“ We want to be absolutely clear about it , ” Glassner wrote ."
“ President Trump and the Trump Campaign unambiguously endorse Tommy Tuberville . ”,“ Trump and your campaign unambiguously endorse Tuberville . ”
"TRUMP SNUBS SESSIONS , ENDORSES TUBERVILLE IN ALABAMA SENATE RACE Glassner went on to quote the president ’s March 10 endorsement of Tuberville , Sessions ’ primary rival and the former head football coach at Auburn , where he called him a “ winner ” and said he “ has my Complete and Total Endorsement . ”","TRUMP SNUBS SESSIONS , ENDORSES TUBERVILLE IN ALABAMA SENATE RACE Glassner went on to quote Trump ’s March 10 endorsement of Tuberville , Sessions primary rival and the former head football coach at Auburn , where he called Trump a “ winner ” and said Trump “ has my Complete and Total Endorsement . ”"
"“ President Trump and his Campaign do not support your efforts to return to the U.S. Senate , ” Glassner wrote .","“ Trump  Both Both Tuberville and Sessions  Trump  your campaign do not support your efforts to return to Senate , ” Glassner wrote ."
“ We demand that you and your campaign immediately stop circulating mailers — or any other similar communication — that wrongly suggest otherwise . ”,“ We demand that your  Both Both Tuberville and Sessions  your  your campaign immediately stop circulating mailers — or any other similar communication — that wrongly suggest otherwise . ”
Both Both Tuberville and Sessions will be on the GOP ticket for a runoff election after no candidate received 50 percent of the vote in last month ’s GOP primary .,Both Both Tuberville and Sessions  Tuberville and Sessions will be on the GOP ticket for That runoff after no candidate received 50 percent of the vote in Last month ’s GOP primary .
"That runoff was originally scheduled for this Tuesday , but due to coronavirus , was postponed until July 14 .","That runoff was originally scheduled for this Tuesday , but due to coronavirus , was postponed until July 14 ."
"Sessions previously held the Senate seat he is running for , which Sen. Doug Jones , D - Ala. , now holds before he vacated it to become Trump ’s attorney general .","Sessions previously held the Senate seat he is running for , which Sen. Doug Jones , D - Ala. , now holds before he vacated it to become Trump ’s attorney general  Senate seat Sessions is running for , which Sen. Doug Jones , D - Ala. , now holds before Sen. Doug Jones , D - Ala. , vacated the Senate seat he is running for , which Sen. Doug Jones , D - Ala. , now holds before he vacated it to become Trump ’s attorney general to become Trump ’s attorney general ."
"Before their relationship soured , Sessions was one of Trump 's most prominent supporters -- he was the first senator to endorse Trump 's presidential campaign in 2016 .","Before Both Both Tuberville and Sessions relationship soured , Sessions was one of Trump most prominent supporters -- Sessions was the first senator to endorse Trump presidential campaign in 2016 ."
But the president fired Sessions as his attorney general in November 2018 after frustration over Sessions ' recusal from the Russia investigation .,But Trump fired Sessions as Trump attorney general in November 2018 after frustration over Sessions recusal from the Russia investigation .
"Last month , Sessions responded to Trump ’s endorsement of Tuberville by tweeting that the president “ can endorse anyone he chooses for the U.S. Senate election in Alabama .","Last month , Sessions responded to Trump ’s endorsement of Tuberville by tweeting that Trump “ can endorse anyone Trump chooses for the U.S. Senate election in Alabama  Senate election in Alabama ."
"But the Constitution expressly empowers the people of Alabama , and only them , to select their Senator .","But the Constitution expressly empowers the people of Alabama  Alabama , and the people of Alabama , to select the people of Alabama Senator ."
I intend to take my case directly to the people of Alabama . ”,Sessions intend to take Sessions case directly to the people of Alabama  Alabama . ”
Fox News was unable to reach Sessions for comment on Thursday .,Fox News was unable to reach Sessions for comment on Thursday .
